[
  {
    "query_id": "q4eu_001",
    "question": "How is a qualified electronic signature validated?",
    "specificity": "H",
    "target_document_codes": [
      "E"
    ],
    "expected_answers_raw": [
      "E Art. 32",
      "E Art. 33",
      "E Rec. 57"
    ],
    "gold_unit_ids": [
      "E Art. 32",
      "E Art. 33",
      "E Rec. 57"
    ],
    "gold_unit_ids_paragraph_level": [
      "E Art. 32",
      "E Art. 33",
      "E Rec. 57"
    ],
    "is_multi_act": false,
    "gold_unit_count": 3,
    "gold_multi_unit": true,
    "gold_has_incoming_xref": true,
    "xref_eligible": true,
    "source": {
      "dataset": "Q4EU",
      "repo": "Francesco-Sovrano/DiscoLQA",
      "commit": "f8614b7d75d4054fb6b02119cde92492172fd6b6"
    }
  },
  {
    "query_id": "q4eu_002",
    "question": "Can an electronic signature be expressed in the form of a pseudonym?",
    "specificity": "N",
    "target_document_codes": [
      "E"
    ],
    "expected_answers_raw": [
      "E Art. 3.14",
      "E Art. 32"
    ],
    "gold_unit_ids": [
      "E Art. 3",
      "E Art. 32"
    ],
    "gold_unit_ids_paragraph_level": [
      "E Art. 3.14",
      "E Art. 32"
    ],
    "is_multi_act": false,
    "gold_unit_count": 2,
    "gold_multi_unit": true,
    "gold_has_incoming_xref": true,
    "xref_eligible": false,
    "source": {
      "dataset": "Q4EU",
      "repo": "Francesco-Sovrano/DiscoLQA",
      "commit": "f8614b7d75d4054fb6b02119cde92492172fd6b6"
    }
  },
  {
    "query_id": "q4eu_003",
    "question": "Can a minor obtain a qualified electronic signature?",
    "specificity": "L",
    "target_document_codes": [
      "E"
    ],
    "expected_answers_raw": [
      "E Art. 3",
      "E Art. 25"
    ],
    "gold_unit_ids": [
      "E Art. 3",
      "E Art. 25"
    ],
    "gold_unit_ids_paragraph_level": [
      "E Art. 3",
      "E Art. 25"
    ],
    "is_multi_act": false,
    "gold_unit_count": 2,
    "gold_multi_unit": true,
    "gold_has_incoming_xref": true,
    "xref_eligible": false,
    "source": {
      "dataset": "Q4EU",
      "repo": "Francesco-Sovrano/DiscoLQA",
      "commit": "f8614b7d75d4054fb6b02119cde92492172fd6b6"
    }
  },
  {
    "query_id": "q4eu_004",
    "question": "From when qualified certificates lose their validity in the case of revocation?",
    "specificity": "N",
    "target_document_codes": [
      "E"
    ],
    "expected_answers_raw": [
      "E Art. 24",
      "E Art. 28"
    ],
    "gold_unit_ids": [
      "E Art. 24",
      "E Art. 28"
    ],
    "gold_unit_ids_paragraph_level": [
      "E Art. 24",
      "E Art. 28"
    ],
    "is_multi_act": false,
    "gold_unit_count": 2,
    "gold_multi_unit": true,
    "gold_has_incoming_xref": true,
    "xref_eligible": false,
    "source": {
      "dataset": "Q4EU",
      "repo": "Francesco-Sovrano/DiscoLQA",
      "commit": "f8614b7d75d4054fb6b02119cde92492172fd6b6"
    }
  },
  {
    "query_id": "q4eu_005",
    "question": "Is a graphometric signature qualified as an advanced electronic signature?",
    "specificity": "L",
    "target_document_codes": [
      "E"
    ],
    "expected_answers_raw": [
      "E Art. 3.11",
      "E Art. 26"
    ],
    "gold_unit_ids": [
      "E Art. 3",
      "E Art. 26"
    ],
    "gold_unit_ids_paragraph_level": [
      "E Art. 3.11",
      "E Art. 26"
    ],
    "is_multi_act": false,
    "gold_unit_count": 2,
    "gold_multi_unit": true,
    "gold_has_incoming_xref": true,
    "xref_eligible": false,
    "source": {
      "dataset": "Q4EU",
      "repo": "Francesco-Sovrano/DiscoLQA",
      "commit": "f8614b7d75d4054fb6b02119cde92492172fd6b6"
    }
  },
  {
    "query_id": "q4eu_006",
    "question": "How should access to trust services be granted to persons with disabilities?",
    "specificity": "N",
    "target_document_codes": [
      "E"
    ],
    "expected_answers_raw": [
      "E Rec. 29",
      "E Art. 15"
    ],
    "gold_unit_ids": [
      "E Rec. 29",
      "E Art. 15"
    ],
    "gold_unit_ids_paragraph_level": [
      "E Rec. 29",
      "E Art. 15"
    ],
    "is_multi_act": false,
    "gold_unit_count": 2,
    "gold_multi_unit": true,
    "gold_has_incoming_xref": false,
    "xref_eligible": false,
    "source": {
      "dataset": "Q4EU",
      "repo": "Francesco-Sovrano/DiscoLQA",
      "commit": "f8614b7d75d4054fb6b02119cde92492172fd6b6"
    }
  },
  {
    "query_id": "q4eu_007",
    "question": "How can the identity of a natural person be verified in the issuing of a qualified certificate?",
    "specificity": "H",
    "target_document_codes": [
      "E"
    ],
    "expected_answers_raw": [
      "E Art. 24.1"
    ],
    "gold_unit_ids": [
      "E Art. 24"
    ],
    "gold_unit_ids_paragraph_level": [
      "E Art. 24.1"
    ],
    "is_multi_act": false,
    "gold_unit_count": 1,
    "gold_multi_unit": false,
    "gold_has_incoming_xref": true,
    "xref_eligible": false,
    "source": {
      "dataset": "Q4EU",
      "repo": "Francesco-Sovrano/DiscoLQA",
      "commit": "f8614b7d75d4054fb6b02119cde92492172fd6b6"
    }
  },
  {
    "query_id": "q4eu_008",
    "question": "Do electronic contracts have the same validity as paper contracts?",
    "specificity": "L",
    "target_document_codes": [
      "E"
    ],
    "expected_answers_raw": [
      "E Rec. 21",
      "E Art. 2.3"
    ],
    "gold_unit_ids": [
      "E Rec. 21",
      "E Art. 2"
    ],
    "gold_unit_ids_paragraph_level": [
      "E Rec. 21",
      "E Art. 2.3"
    ],
    "is_multi_act": false,
    "gold_unit_count": 2,
    "gold_multi_unit": true,
    "gold_has_incoming_xref": true,
    "xref_eligible": false,
    "source": {
      "dataset": "Q4EU",
      "repo": "Francesco-Sovrano/DiscoLQA",
      "commit": "f8614b7d75d4054fb6b02119cde92492172fd6b6"
    }
  },
  {
    "query_id": "q4eu_009",
    "question": "Why is there a specific discipline for the notification of security breaches?",
    "specificity": "H",
    "target_document_codes": [
      "E"
    ],
    "expected_answers_raw": [
      "E Rec. 38",
      "E Art. 19.2"
    ],
    "gold_unit_ids": [
      "E Rec. 38",
      "E Art. 19"
    ],
    "gold_unit_ids_paragraph_level": [
      "E Rec. 38",
      "E Art. 19.2"
    ],
    "is_multi_act": false,
    "gold_unit_count": 2,
    "gold_multi_unit": true,
    "gold_has_incoming_xref": true,
    "xref_eligible": false,
    "source": {
      "dataset": "Q4EU",
      "repo": "Francesco-Sovrano/DiscoLQA",
      "commit": "f8614b7d75d4054fb6b02119cde92492172fd6b6"
    }
  },
  {
    "query_id": "q4eu_010",
    "question": "When shall a trust service provider notify affected individuals and users?",
    "specificity": "H",
    "target_document_codes": [
      "E"
    ],
    "expected_answers_raw": [
      "E Art. 19.2"
    ],
    "gold_unit_ids": [
      "E Art. 19"
    ],
    "gold_unit_ids_paragraph_level": [
      "E Art. 19.2"
    ],
    "is_multi_act": false,
    "gold_unit_count": 1,
    "gold_multi_unit": false,
    "gold_has_incoming_xref": true,
    "xref_eligible": false,
    "source": {
      "dataset": "Q4EU",
      "repo": "Francesco-Sovrano/DiscoLQA",
      "commit": "f8614b7d75d4054fb6b02119cde92492172fd6b6"
    }
  },
  {
    "query_id": "q4eu_011",
    "question": "What is the applicable law to the trust service provider which provides its trusted services in a Member State different from the one where it is established?",
    "specificity": "L",
    "target_document_codes": [
      "E"
    ],
    "expected_answers_raw": [
      "E Rec. 22",
      "E Rec. 42",
      "E Art. 4",
      "E Art. 6",
      "E Art. 24"
    ],
    "gold_unit_ids": [
      "E Rec. 22",
      "E Rec. 42",
      "E Art. 4",
      "E Art. 6",
      "E Art. 24"
    ],
    "gold_unit_ids_paragraph_level": [
      "E Rec. 22",
      "E Rec. 42",
      "E Art. 4",
      "E Art. 6",
      "E Art. 24"
    ],
    "is_multi_act": false,
    "gold_unit_count": 5,
    "gold_multi_unit": true,
    "gold_has_incoming_xref": true,
    "xref_eligible": false,
    "source": {
      "dataset": "Q4EU",
      "repo": "Francesco-Sovrano/DiscoLQA",
      "commit": "f8614b7d75d4054fb6b02119cde92492172fd6b6"
    }
  },
  {
    "query_id": "q4eu_012",
    "question": "How can qualified certificates be temporally limited?",
    "specificity": "N",
    "target_document_codes": [
      "E"
    ],
    "expected_answers_raw": [
      "E Rec. 53",
      "E Art. 24.4",
      "E Art. 28",
      "E Art. 38.5"
    ],
    "gold_unit_ids": [
      "E Rec. 53",
      "E Art. 24",
      "E Art. 28",
      "E Art. 38"
    ],
    "gold_unit_ids_paragraph_level": [
      "E Rec. 53",
      "E Art. 24.4",
      "E Art. 28",
      "E Art. 38.5"
    ],
    "is_multi_act": false,
    "gold_unit_count": 4,
    "gold_multi_unit": true,
    "gold_has_incoming_xref": true,
    "xref_eligible": false,
    "source": {
      "dataset": "Q4EU",
      "repo": "Francesco-Sovrano/DiscoLQA",
      "commit": "f8614b7d75d4054fb6b02119cde92492172fd6b6"
    }
  },
  {
    "query_id": "q4eu_013",
    "question": "What are the requirements for website authentication?",
    "specificity": "N",
    "target_document_codes": [
      "E"
    ],
    "expected_answers_raw": [
      "E Rec. 67",
      "E Art. 45"
    ],
    "gold_unit_ids": [
      "E Rec. 67",
      "E Art. 45"
    ],
    "gold_unit_ids_paragraph_level": [
      "E Rec. 67",
      "E Art. 45"
    ],
    "is_multi_act": false,
    "gold_unit_count": 2,
    "gold_multi_unit": true,
    "gold_has_incoming_xref": true,
    "xref_eligible": false,
    "source": {
      "dataset": "Q4EU",
      "repo": "Francesco-Sovrano/DiscoLQA",
      "commit": "f8614b7d75d4054fb6b02119cde92492172fd6b6"
    }
  },
  {
    "query_id": "q4eu_014",
    "question": "When do electronic signatures qualify as \"advanced electronic signatures\"?",
    "specificity": "N",
    "target_document_codes": [
      "E"
    ],
    "expected_answers_raw": [
      "E Art. 3.11",
      "E Art. 26"
    ],
    "gold_unit_ids": [
      "E Art. 3",
      "E Art. 26"